id,page,group,type,question,image,filename
extra-dirty-082,406,Extra Dirty,Straight Up,Imagine we’re your future (or current) children. Tell us how babies are made.,cards/extra-dirty/extra-dirty-082-straight-up.png,extra-dirty-082-straight-up.png
extra-dirty-083,407,Extra Dirty,This Round's On Me,"Who here do you think you’d be most sexually compatible with? Present and past partners excluded. Remember, this is just hypothetical.",cards/extra-dirty/extra-dirty-083-this-rounds-on-me.png,extra-dirty-083-this-rounds-on-me.png
extra-dirty-084,408,Extra Dirty,Straight Up,What did you observe from porn that you later realized was unrealistic? How’d you make this discovery?,cards/extra-dirty/extra-dirty-084-straight-up.png,extra-dirty-084-straight-up.png
extra-dirty-085,409,Extra Dirty,Make It a Double,Do you have a go-to sex move? Where did you learn it?,cards/extra-dirty/extra-dirty-085-make-it-a-double.png,extra-dirty-085-make-it-a-double.png
extra-dirty-086,410,Extra Dirty,Straight Up,Who was the last person (besides your partner or your doctor) who’s seen your junk?,cards/extra-dirty/extra-dirty-086-straight-up.png,extra-dirty-086-straight-up.png
extra-dirty-087,411,Extra Dirty,Straight Up,"If you had to write a quick-start guide to getting you off, what are the key bullet points?",cards/extra-dirty/extra-dirty-087-straight-up.png,extra-dirty-087-straight-up.png
extra-dirty-088,412,Extra Dirty,Straight Up,What’s the kinkiest thing you’ve asked someone else to do? Did they oblige?,cards/extra-dirty/extra-dirty-088-straight-up.png,extra-dirty-088-straight-up.png
extra-dirty-089,413,Extra Dirty,Straight Up,"If we were stuck on a desert island, how many days until we fuck out of boredom?",cards/extra-dirty/extra-dirty-089-straight-up.png,extra-dirty-089-straight-up.png
extra-dirty-090,414,Extra Dirty,This Round's On Me,Have you ever been injured during sex? Or injured someone else? Heartbreaks don’t count.,cards/extra-dirty/extra-dirty-090-this-rounds-on-me.png,extra-dirty-090-this-rounds-on-me.png
extra-dirty-091,415,Extra Dirty,Straight Up,Quick! Name your favorite porn star. And tell us about all the wonderful qualities that make them special.,cards/extra-dirty/extra-dirty-091-straight-up.png,extra-dirty-091-straight-up.png
extra-dirty-092,416,Extra Dirty,This Round's On Me,"If I had a hot sibling, would they be off-limits, sex-wise?",cards/extra-dirty/extra-dirty-092-this-rounds-on-me.png,extra-dirty-092-this-rounds-on-me.png
extra-dirty-093,417,Extra Dirty,Straight Up,"If I had a hot parent, would you let them seduce you?",cards/extra-dirty/extra-dirty-093-straight-up.png,extra-dirty-093-straight-up.png
extra-dirty-094,418,Extra Dirty,Make It a Double,What will be the sexy nickname they give you when you live at the old-folks’ home?,cards/extra-dirty/extra-dirty-094-make-it-a-double.png,extra-dirty-094-make-it-a-double.png
extra-dirty-095,419,Extra Dirty,This Round's On Me,Describe your first time having sex. Include every cringey detail.,cards/extra-dirty/extra-dirty-095-this-rounds-on-me.png,extra-dirty-095-this-rounds-on-me.png
extra-dirty-096,420,Extra Dirty,This Round's On Me,When was the last time you were tested for a sexually transmitted infection? What were the results?,cards/extra-dirty/extra-dirty-096-this-rounds-on-me.png,extra-dirty-096-this-rounds-on-me.png
extra-dirty-097,421,Extra Dirty,Straight Up,"On the spectrum of “sober as a judge” to “falling-down drunk,” where do you have the best sex?",cards/extra-dirty/extra-dirty-097-straight-up.png,extra-dirty-097-straight-up.png
extra-dirty-098,422,Extra Dirty,Straight Up,Do you have an age ceiling for a one-night stand?,cards/extra-dirty/extra-dirty-098-straight-up.png,extra-dirty-098-straight-up.png
extra-dirty-099,423,Extra Dirty,This Round's On Me,Who here would have the best sexual chemistry with me? Based upon what evidence?,cards/extra-dirty/extra-dirty-099-this-rounds-on-me.png,extra-dirty-099-this-rounds-on-me.png
